[
  {
    "verification_id": "E_TARGET_PRESENT",
    "kind": "UNIT_TEST",
    "claim_strength": "STRUCTURAL_PRESENCE",
    "covered_target_rule_ids": [],
    "concrete_refs": [
      "tests/test_phase1_migration_claim_truthfulness.py::MigrationClaimTruthfulness::test_every_target_rule_exists"
    ],
    "coverage_statement": "Every migration target resolves to an active current Project Source rule ID.",
    "limitations": [
      "Target presence does not prove behavioral equivalence."
    ],
    "allowed_capability_ids": []
  },
  {
    "verification_id": "E_SOURCE_INDEX",
    "kind": "COMMAND",
    "claim_strength": "SOURCE_CONSISTENCY",
    "covered_target_rule_ids": [],
    "concrete_refs": [
      "python runtime/joyflow_source_validator.py ."
    ],
    "coverage_statement": "Current Project Sources and generated rule index are mechanically consistent.",
    "limitations": [
      "Source consistency does not prove runtime behavior."
    ],
    "allowed_capability_ids": []
  },
  {
    "verification_id": "E_EXPLICIT_DEFERRAL",
    "kind": "POLICY",
    "claim_strength": "EXPLICIT_DEFERRAL",
    "covered_target_rule_ids": [
      "JF_DL_DEFERRED_SCOPE_RULE"
    ],
    "concrete_refs": [
      "project_sources/10_DEFERRED_AREAS.md"
    ],
    "coverage_statement": "The capability is explicitly outside the current active scope.",
    "limitations": [
      "Deferred behavior is not implemented or verified."
    ],
    "allowed_capability_ids": []
  },
  {
    "verification_id": "E_RETIREMENT_RATIONALE",
    "kind": "POLICY",
    "claim_strength": "RETIREMENT_RATIONALE",
    "covered_target_rule_ids": [],
    "concrete_refs": [
      "project_sources/14_PHASE1F_MIGRATION_CLAIM_TRUTHFULNESS.md"
    ],
    "coverage_statement": "Retired forms retain a reason and current replacement target.",
    "limitations": [
      "Retirement rationale is not runtime equivalence evidence."
    ],
    "allowed_capability_ids": []
  },
  {
    "verification_id": "E_MIGRATION_TRUTHFULNESS_ADVERSARIAL",
    "kind": "UNIT_TEST",
    "claim_strength": "BEHAVIOR_ADVERSARIAL",
    "covered_target_rule_ids": [
      "RULE_LEGACY_SOURCE_IDENTITY_SET",
      "RULE_BRAIN_OWNED_LEGACY_SEMANTIC_MAPPING",
      "RULE_LEGACY_DISPOSITION_DECISION_SEPARATION",
      "RULE_LEGACY_MIGRATION_EVIDENCE_STRENGTH",
      "RULE_LEGACY_MIGRATION_PER_TARGET_COVERAGE",
      "RULE_LEGACY_MIGRATION_STATUS_SEMANTICS",
      "RULE_CAPABILITY_STATUS_NAVIGATION_ONLY",
      "RULE_CAPABILITY_EVIDENCE_CONTRACT_BINDING",
      "RULE_CURRENT_CANDIDATE_DOCUMENT_IDENTITY",
      "RULE_LEGACY_MIGRATION_SCHEMA_CLOSURE",
      "RULE_LEGACY_PHASE_EFFECT_SEPARATION",
      "RULE_DERIVED_TARGET_BEHAVIOR_STATUS",
      "RULE_PRODUCT_DIRECTION_BOUND_DISPOSITION_AUTHORITY",
      "RULE_SPARSE_USER_DECISION_GATE",
      "RULE_DISPOSITION_PRODUCT_DIRECTION_EFFECT",
      "RULE_PR1F_MECHANISM_EFFECT_SCOPE",
      "RULE_HISTORICAL_REVIEW_CONTEXT_MARKING",
      "RULE_DISPOSITION_TRANSITION_CONTRACT_SINGLE_SOURCE",
      "RULE_TECHNICAL_RETIREMENT_SEMANTIC_EVIDENCE_GATE",
      "RULE_DISPOSITION_TRANSITION_POSITIVE_COVERAGE",
      "RULE_CURRENT_MIGRATION_INSTANCE_TRANSITION_CAPABILITY_SEPARATION",
      "RULE_EXACT_LEGACY_SOURCE_REPLAY_FIXTURE_BOUNDARY",
      "RULE_DISPOSITION_EVIDENCE_OUTCOME_CONTRACT_COMPLETE",
      "RULE_PUBLIC_TRANSITION_PATH_POSITIVE_COVERAGE",
      "RULE_MAPPING_SOURCE_SET_SINGLE_OWNER",
      "RULE_SEMANTIC_EVIDENCE_EXACT_OBJECT_BINDING",
      "RULE_SEMANTIC_EVIDENCE_MECHANICAL_SEMANTIC_BOUNDARY",
      "RULE_DEFERRED_STATUS_BASIS_TRUTHFULNESS",
      "RULE_CONFIRMED_TRANSITION_VALIDATED_BOUNDARY",
      "RULE_CONFIRMED_TRANSITION_SEAL_CONSUMPTION",
      "RULE_PACKAGE_RELATIVE_EXACT_SOURCE_BINDING",
      "RULE_ORDERED_SECTION_BOUNDARY",
      "RULE_DERIVED_MAPPING_STATUS",
      "RULE_CAPABILITY_CLAIM_TYPE_SEPARATION",
      "RULE_INHERITED_STAGE_PRESENCE_SCOPE",
      "RULE_VERIFIED_RULE_COVERAGE_EXACT",
      "RULE_VERIFIED_CROSS_STAGE_CHAIN_SCOPE",
      "RULE_CAPABILITY_COVERAGE_RELATION_BINDING"
    ],
    "concrete_refs": [
      "tests/test_phase1_migration_claim_truthfulness.py::MigrationClaimTruthfulness::test_every_target_rule_exists",
      "tests/test_phase1_migration_claim_truthfulness.py::MigrationClaimTruthfulness::test_all_concrete_verification_refs_resolve",
      "tests/test_phase1_migration_claim_truthfulness.py::MigrationClaimTruthfulness::test_former_conflated_capability_input_removed",
      "tests/test_phase1_migration_claim_truthfulness.py::MigrationClaimTruthfulness::test_current_candidate_has_no_legacy_equivalence_claim",
      "tests/test_phase1_migration_claim_truthfulness.py::MigrationClaimTruthfulness::test_all_dispositions_are_not_evaluated",
      "tests/test_phase1_migration_claim_truthfulness.py::MigrationClaimTruthfulness::test_all_current_product_direction_effects_are_unresolved",
      "tests/test_phase1_migration_claim_truthfulness.py::MigrationClaimTruthfulness::test_behavior_status_requires_exact_text_and_confirmed_brain_mapping",
      "tests/test_phase1_migration_claim_truthfulness.py::MigrationClaimTruthfulness::test_brain_interpretation_mutation_without_digest_blocks",
      "tests/test_phase1_migration_claim_truthfulness.py::MigrationClaimTruthfulness::test_wrong_inventory_section_blocks",
      "tests/test_phase1_migration_claim_truthfulness.py::MigrationClaimTruthfulness::test_wrong_legacy_source_hash_blocks",
      "tests/test_phase1_migration_claim_truthfulness.py::MigrationClaimTruthfulness::test_semantic_mapping_cannot_contain_disposition",
      "tests/test_phase1_migration_claim_truthfulness.py::MigrationClaimTruthfulness::test_unsealed_disposition_mutation_blocks",
      "tests/test_phase1_migration_claim_truthfulness.py::MigrationClaimTruthfulness::test_defer_requires_exact_current_basis",
      "tests/test_phase1_migration_claim_truthfulness.py::MigrationClaimTruthfulness::test_retire_by_product_requires_user_owner_and_ref",
      "tests/test_phase1_migration_claim_truthfulness.py::MigrationClaimTruthfulness::test_brain_technical_defer_does_not_require_user_row_approval",
      "tests/test_phase1_migration_claim_truthfulness.py::MigrationClaimTruthfulness::test_brain_cannot_close_unknown_material_effect",
      "tests/test_phase1_migration_claim_truthfulness.py::MigrationClaimTruthfulness::test_brain_cannot_change_confirmed_product_direction",
      "tests/test_phase1_migration_claim_truthfulness.py::MigrationClaimTruthfulness::test_current_product_decision_requires_exact_user_ref",
      "tests/test_phase1_migration_claim_truthfulness.py::MigrationClaimTruthfulness::test_technical_duplication_retirement_requires_confirmed_semantic_gate",
      "tests/test_phase1_migration_claim_truthfulness.py::MigrationClaimTruthfulness::test_legacy_semantic_retirement_requires_confirmed_semantic_gate",
      "tests/test_phase1_migration_claim_truthfulness.py::MigrationClaimTruthfulness::test_transition_contract_all_legal_combinations_align_schema_validator_and_deriver",
      "tests/test_phase1_migration_claim_truthfulness.py::MigrationClaimTruthfulness::test_transition_contract_schema_rejects_unsupported_combination",
      "tests/test_phase1_migration_claim_truthfulness.py::MigrationClaimTruthfulness::test_technical_duplication_retirement_derives_confirmed_semantic_supersession",
      "tests/test_phase1_migration_claim_truthfulness.py::MigrationClaimTruthfulness::test_structural_or_source_evidence_cannot_support_behavior_status",
      "tests/test_phase1_migration_claim_truthfulness.py::MigrationClaimTruthfulness::test_multi_target_missing_one_behavior_ref_is_derived_partial",
      "tests/test_phase1_migration_claim_truthfulness.py::MigrationClaimTruthfulness::test_behavior_verified_targets_and_unverified_targets_are_disjoint",
      "tests/test_phase1_migration_claim_truthfulness.py::MigrationClaimTruthfulness::test_verified_behavior_does_not_close_legacy_equivalence",
      "tests/test_phase1_migration_claim_truthfulness.py::MigrationClaimTruthfulness::test_phase_effect_keeps_disposition_open",
      "tests/test_phase1_migration_claim_truthfulness.py::MigrationClaimTruthfulness::test_phase_effect_does_not_block_truthful_mechanism",
      "tests/test_phase1_migration_claim_truthfulness.py::MigrationClaimTruthfulness::test_phase_effect_does_not_decide_phase1_completion",
      "tests/test_phase1_migration_claim_truthfulness.py::MigrationClaimTruthfulness::test_retirement_policy_cannot_be_target_behavior_evidence",
      "tests/test_phase1_migration_claim_truthfulness.py::MigrationClaimTruthfulness::test_legacy_source_schema_rejects_unknown_field",
      "tests/test_phase1_migration_claim_truthfulness.py::MigrationClaimTruthfulness::test_brain_mapping_schema_rejects_wrong_owner_type",
      "tests/test_phase1_migration_claim_truthfulness.py::MigrationClaimTruthfulness::test_disposition_schema_rejects_unknown_field",
      "tests/test_phase1_migration_claim_truthfulness.py::MigrationClaimTruthfulness::test_migration_schema_rejects_old_ambiguous_field",
      "tests/test_phase1_migration_claim_truthfulness.py::MigrationClaimTruthfulness::test_nonexistent_test_symbol_blocks",
      "tests/test_phase1_migration_claim_truthfulness.py::MigrationClaimTruthfulness::test_capability_status_is_navigation_only",
      "tests/test_phase1_migration_claim_truthfulness.py::MigrationClaimTruthfulness::test_capability_status_exact_registry_subjects",
      "tests/test_phase1_migration_claim_truthfulness.py::MigrationClaimTruthfulness::test_arbitrary_capability_name_blocks_even_in_view",
      "tests/test_phase1_migration_claim_truthfulness.py::MigrationClaimTruthfulness::test_unrelated_concrete_ref_breaks_capability_contract",
      "tests/test_phase1_migration_claim_truthfulness.py::MigrationClaimTruthfulness::test_package_cannot_self_claim_independent_cold_review",
      "tests/test_phase1_migration_claim_truthfulness.py::MigrationClaimTruthfulness::test_capability_view_cannot_be_promoted_to_gate",